{
  "$schema": "https://json-schema.org/draft/2020-12/schema",
  "title": "Entity Definition Schema v1",
  "type": "object",
  "required": ["indexId", "entityName", "sourceIndexingIds", "source", "transform", "emit", "retention", "limits"],
  "properties": {
    "$schema": { "type": "string" },
    "indexId": { "type": "string", "minLength": 1 },
    "entityName": { "type": "string", "minLength": 1 },
    "sourceIndexingIds": {
      "type": "array",
      "minItems": 1,
      "items": { "type": "string", "minLength": 1 }
    },
    "retention": {
      "type": "string",
      "pattern": "^[1-9][0-9]*(s|m|h|d)$"
    },
    "limits": {
      "type": "object",
      "required": ["maxLagSeconds", "maxBacklogRows", "maxTableBytes", "maxApiP95Ms"],
      "properties": {
        "maxLagSeconds": { "type": "integer", "minimum": 1 },
        "maxBacklogRows": { "type": "integer", "minimum": 1 },
        "maxTableBytes": { "type": "integer", "minimum": 1 },
        "maxApiP95Ms": { "type": "integer", "minimum": 1 }
      },
      "additionalProperties": false
    },
    "source": {
      "type": "object",
      "required": ["from", "recordName"],
      "properties": {
        "from": { "enum": ["state", "record"] },
        "recordKind": { "type": "string" },
        "retention": {
          "type": "string",
          "pattern": "^[1-9][0-9]*(s|m|h|d)$"
        },
        "sourceIndexingIds": {
          "type": "array",
          "minItems": 1,
          "items": { "type": "string" }
        },
        "recordName": {
          "oneOf": [
            { "type": "string" },
            { "type": "array", "items": { "type": "string" }, "minItems": 1 }
          ]
        }
      },
      "additionalProperties": false
    },
    "transform": {
      "type": "object",
      "properties": {
        "extract": {
          "type": "object",
          "additionalProperties": true
        },
        "resolve": {
          "type": "array",
          "items": {
            "type": "object",
            "required": ["name", "from", "recordName", "retention"],
            "properties": {
              "name": { "type": "string" },
              "from": { "enum": ["state", "record"] },
              "recordKind": { "type": "string" },
              "retention": {
                "type": "string",
                "pattern": "^[1-9][0-9]*(s|m|h|d)$"
              },
              "sourceIndexingIds": {
                "type": "array",
                "minItems": 1,
                "items": { "type": "string" }
              },
              "recordName": {
                "oneOf": [
                  { "type": "string" },
                  { "type": "array", "items": { "type": "string" }, "minItems": 1 }
                ]
              },
              "where": {
                "type": "object",
                "additionalProperties": true
              }
            },
            "additionalProperties": false
          }
        },
        "compute": {
          "type": "array",
          "items": {
            "type": "object",
            "required": ["ref", "inputs", "output"],
            "properties": {
              "ref": { "type": "string" },
              "inputs": {
                "type": "object",
                "additionalProperties": true
              },
              "output": { "type": "string" }
            },
            "additionalProperties": false
          }
        },
        "groupBy": {
          "type": "array",
          "items": { "type": "string" }
        },
        "reduce": {
          "type": "object",
          "additionalProperties": {
            "type": "object",
            "required": ["op"],
            "properties": {
              "op": { "type": "string" },
              "value": true
            },
            "additionalProperties": false
          }
        }
      },
      "additionalProperties": false
    },
    "emit": {
      "type": "object",
      "required": ["id", "fields"],
      "properties": {
        "id": {
          "oneOf": [
            { "type": "string" },
            { "type": "array", "items": { "type": "string" }, "minItems": 1 }
          ]
        },
        "indexes": {
          "type": "array",
          "items": {
            "type": "array",
            "items": { "type": "string" },
            "minItems": 1
          }
        },
        "timeField": { "type": "string" },
        "defaultOrderBy": {
          "type": "array",
          "items": { "type": "string" }
        },
        "fields": {
          "type": "object",
          "additionalProperties": {
            "type": "object",
            "required": ["type"],
            "properties": {
              "type": { "type": "string" },
              "primaryKey": { "type": "boolean" },
              "filterable": { "type": "boolean" },
              "value": true
            },
            "additionalProperties": false
          }
        }
      },
      "additionalProperties": false
    }
  },
  "additionalProperties": false
}
