{
  "$schema": "/indexing/entities/entity_definition_schema.v1.json",
  "indexId": "pump-amm-pool-mainnet",
  "entityName": "Pool",
  "sourceIndexingIds": ["pump-amm-mainnet"],
  "retention": "30d",
  "limits": {
    "maxLagSeconds": 30,
    "maxBacklogRows": 1000000,
    "maxTableBytes": 107374182400,
    "maxApiP95Ms": 1000
  },
  "source": {
    "from": "state",
    "recordKind": "account",
    "recordName": "PoolMetadata"
  },
  "transform": {
    "extract": {
      "pool": "$raw.subject_id",
      "mint": "$state.mint",
      "quoteMint": "$state.quoteMint",
      "coinCreator": "$state.coinCreator",
      "isCashbackCoin": "$state.isCashbackCoin",
      "observedAt": "$state.observedAt",
      "updatedAt": "$raw.updated_at",
      "poolQuoteReservesAtomic": "$state.poolQuoteReservesAtomic"
    }
  },
  "emit": {
    "id": "pool",
    "indexes": [
      ["mint", "updatedAt:desc"],
      ["quoteMint", "updatedAt:desc"]
    ],
    "timeField": "updatedAt",
    "defaultOrderBy": ["updatedAt:desc"],
    "fields": {
      "mint": { "type": "TEXT", "filterable": true },
      "pool": { "type": "TEXT", "primaryKey": true, "filterable": true },
      "quoteMint": { "type": "TEXT", "filterable": true },
      "coinCreator": { "type": "TEXT" },
      "isCashbackCoin": { "type": "BOOLEAN" },
      "observedAt": { "type": "TIMESTAMPTZ", "filterable": true },
      "updatedAt": { "type": "TIMESTAMPTZ", "filterable": true },
      "poolQuoteReservesAtomic": { "type": "NUMERIC" }
    }
  }
}
